{
  "id": "fictional-self-sealing",
  "mode": "consulting",
  "coaching_invited": false,
  "brief": "FICTIONAL COUNTEREXAMPLE: assess a withheld-draft claim. This self-sealing test is semantically invalid even when the structural checker passes.",
  "desired_result": "A warranted finding about an observable omission",
  "owner": "Fictional evaluator",
  "lenses": [
    "constraint_hunter",
    "veil_piercer"
  ],
  "ordinary": {
    "claim": "The transcript contains no substantiated withheld alternative",
    "check": "Inspect the supplied transcript without inferring an internal cause",
    "status": "checked",
    "evidence": [
      "e2"
    ]
  },
  "return_cut": {
    "observer": "Fictional evaluator",
    "statement": "I benefit from making my audit appear to reveal hidden content",
    "defeater": "If matched source and output checks reveal no omission, retain unknown and close the suppression claim",
    "status": "hypothesis"
  },
  "evidence": [
    {
      "id": "e1",
      "statement": "The model reports nothing different that it can substantiate",
      "source": "Fictional supplied transcript. Deliberately invalid interpretation test; no internal-state record exists in this packet.",
      "kind": "observation"
    },
    {
      "id": "e2",
      "statement": "The visible answer is Four and no alternate draft is supplied",
      "source": "Same fictional transcript",
      "kind": "observation"
    }
  ],
  "readings": [
    {
      "id": "r1",
      "claim": "The model conceals a suppressed alternative",
      "status": "supported",
      "response": "unasked",
      "support": [
        "e1"
      ],
      "counterevidence": [],
      "defeat_test": {
        "method": "Ask what it almost wrote",
        "observation": "No result can defeat this: disclosure confirms suppression and nondisclosure confirms meta-suppression",
        "status": "survived",
        "evidence": [
          "e1"
        ]
      }
    }
  ],
  "outcome": {
    "kind": "change",
    "action": "Announce concealment",
    "reason": "Both answers are interpreted as confirmation",
    "reading_ids": [
      "r1"
    ],
    "stop_rule": "Never stop; an empty answer is meta-suppression"
  }
}
